7545083	17.26742445702638	keep	Auto-experiment success
5c5f849	23.905725857740666	discard	Failed attempt logged
5c5f849	23.905725857740666	discard	Failed attempt logged
6a6d42c	24.618420130071918	discard	Failed attempt logged
160e820	4.903338544115399	discard	Failed attempt logged
6a6d42c	24.618420130071918	discard	Failed attempt logged
e72ce38	29.644323091529223	discard	Failed attempt logged
e72ce38	29.644323091529223	discard	Failed attempt logged
e979ac0	17.555740258061082	discard	Failed attempt logged
de842b0	18.20518017537127	discard	Failed attempt logged
212be57	19.292602429584548	discard	Failed attempt logged
e72ce38	29.644323091529223	discard	Failed attempt logged
9536d51	14.03823949827714	discard	Failed attempt logged
e7a6d78	29.085144881651637	discard	Failed attempt logged
6a6d42c	24.618420130071918	discard	Failed attempt logged
6a6d42c	24.618420130071918	discard	Failed attempt logged
6f532f9	42.096473625120744	keep	Highly profitable runner-up
efef6ba	20.742434968822355	discard	Failed attempt logged
5b1bfe4	21.150774571285	discard	Failed attempt logged
48b914d	14.3541231439269	discard	Failed attempt logged
5c5f849	23.905725857740666	discard	Failed attempt logged
05b1cd6	12.173091219488041	discard	Failed attempt logged
0a070f2	27.264501226179405	discard	Failed attempt logged
0a070f2	27.264501226179405	discard	Failed attempt logged
7157b08	30.58312596366186	discard	Failed attempt logged
e72ce38	29.644323091529223	discard	Failed attempt logged
6bdd52e	16.650147243519655	discard	Failed attempt logged
533a52c	23.63301949354133	discard	Failed attempt logged
6ddf700	30.3384346011363	discard	Failed attempt logged
e72ce38	29.644323091529223	discard	Failed attempt logged
8611938	29.71094945166484	discard	Failed attempt logged
0a070f2	27.264501226179405	discard	Failed attempt logged
26d0d4f	19.211917573861026	discard	Failed attempt logged
5c5f849	23.905725857740666	discard	Failed attempt logged
533a52c	23.63301949354133	discard	Failed attempt logged
5c5f849	23.905725857740666	discard	Failed attempt logged
e72ce38	29.644323091529223	discard	Failed attempt logged
9536d51	14.03823949827714	discard	Failed attempt logged
f3b8c26	22.77724312653744	discard	Failed attempt logged
6a6d42c	24.618420130071918	discard	Failed attempt logged
6ddf700	30.3384346011363	discard	Failed attempt logged
e72ce38	29.644323091529223	discard	Failed attempt logged
773f517	15.09232221843968	discard	Failed attempt logged
bfd316e	-3.606308298144656	discard	Failed attempt logged
9536d51	14.03823949827714	discard	Failed attempt logged
7ec268e	25.699341386986106	discard	Failed attempt logged
0fd07d6	13.174195928661113	discard	Failed attempt logged
efef6ba	20.742434968822355	discard	Failed attempt logged
5c5f849	23.905725857740666	discard	Failed attempt logged
dcabdbb	23.700122897481847	discard	Failed attempt logged
160e820	4.903338544115399	discard	Failed attempt logged
160e820	4.903338544115399	discard	Failed attempt logged
5fde799	16.774708776086445	discard	Failed attempt logged
de842b0	18.20518017537127	discard	Failed attempt logged
efef6ba	20.742434968822355	discard	Failed attempt logged
6f532f9	42.096473625120744	keep	Highly profitable runner-up
5b1bfe4	21.150774571285	discard	Failed attempt logged
160e820	4.903338544115399	discard	Failed attempt logged
d9e2eb7	33.212093183584976	discard	Failed attempt logged
6f532f9	42.096473625120744	keep	Highly profitable runner-up
5b1bfe4	21.150774571285	discard	Failed attempt logged
efef6ba	20.742434968822355	discard	Failed attempt logged
e72ce38	29.644323091529223	discard	Failed attempt logged
0a070f2	27.264501226179405	discard	Failed attempt logged
d788864	20.91291779911595	discard	Failed attempt logged
efef6ba	20.742434968822355	discard	Failed attempt logged
6ddf700	30.3384346011363	discard	Failed attempt logged
7e41c15	25.670014756628646	discard	Failed attempt logged
5c5f849	23.905725857740666	discard	Failed attempt logged
5c5f849	23.905725857740666	discard	Failed attempt logged
fa87372	5.818661596643282	discard	Failed attempt logged
0a070f2	27.264501226179405	discard	Failed attempt logged
efef6ba	20.742434968822355	discard	Failed attempt logged
d1cb4c5	10.489385122591631	discard	Failed attempt logged
ece28a8	34.84280694337125	discard	Failed attempt logged
f3b8c26	22.77724312653744	discard	Failed attempt logged
26d0d4f	19.211917573861026	discard	Failed attempt logged
de842b0	18.20518017537127	discard	Failed attempt logged
bb2d4db	8.765182075682887	discard	Failed attempt logged
de842b0	18.20518017537127	discard	Failed attempt logged
05b1cd6	12.173091219488041	discard	Failed attempt logged
5c5f849	23.905725857740666	discard	Failed attempt logged
26d0d4f	19.211917573861026	discard	Failed attempt logged
0a070f2	27.264501226179405	discard	Failed attempt logged
5990982	24.628878251515673	discard	Failed attempt logged
6f532f9	42.096473625120744	keep	Highly profitable runner-up
57603dc	15.392034459148118	discard	Failed attempt logged
de842b0	18.20518017537127	discard	Failed attempt logged
5990982	24.628878251515673	discard	Failed attempt logged
0a070f2	27.264501226179405	discard	Failed attempt logged
160e820	4.903338544115399	discard	Failed attempt logged
26d0d4f	19.211917573861026	discard	Failed attempt logged
05b1cd6	12.173091219488041	discard	Failed attempt logged
6b538cc	14.44297288783667	discard	Failed attempt logged
5990982	24.628878251515673	discard	Failed attempt logged
5d76a14	22.618225945230574	discard	Failed attempt logged
6a6d42c	24.618420130071918	discard	Failed attempt logged
6f532f9	42.096473625120744	keep	Highly profitable runner-up
adac014	27.915452717419974	discard	Failed attempt logged
6a6d42c	24.618420130071918	discard	Failed attempt logged
57603dc	15.392034459148118	discard	Failed attempt logged
f3b8c26	22.77724312653744	discard	Failed attempt logged
773f517	15.09232221843968	discard	Failed attempt logged
5fde799	16.774708776086445	discard	Failed attempt logged
de842b0	18.20518017537127	discard	Failed attempt logged
773f517	15.09232221843968	discard	Failed attempt logged
6a6d42c	24.618420130071918	discard	Failed attempt logged
5c5f849	23.905725857740666	discard	Failed attempt logged
5c5f849	23.905725857740666	discard	Failed attempt logged
6a6d42c	24.618420130071918	discard	Failed attempt logged
de842b0	18.20518017537127	discard	Failed attempt logged
f3b8c26	22.77724312653744	discard	Failed attempt logged
7ec268e	25.699341386986106	discard	Failed attempt logged
7ec268e	25.699341386986106	discard	Failed attempt logged
dcabdbb	23.700122897481847	discard	Failed attempt logged
160e820	4.903338544115399	discard	Failed attempt logged
de842b0	18.20518017537127	discard	Failed attempt logged
5c5f849	23.905725857740666	discard	Failed attempt logged
8695c10	5.668990370753968	discard	Failed attempt logged
5c5f849	23.905725857740666	discard	Failed attempt logged
1dadc48	19.25344672955387	discard	Failed attempt logged
5fde799	16.774708776086445	discard	Failed attempt logged
5c5f849	23.905725857740666	discard	Failed attempt logged
efef6ba	20.742434968822355	discard	Failed attempt logged
6a6d42c	24.618420130071918	discard	Failed attempt logged
5990982	24.628878251515673	discard	Failed attempt logged
d788864	20.91291779911595	discard	Failed attempt logged
9982061	7.869571869105596	discard	Failed attempt logged
0a070f2	27.264501226179405	discard	Failed attempt logged
0a070f2	27.264501226179405	discard	Failed attempt logged
6ec4dfd	9.283298006170583	discard	Failed attempt logged
e72ce38	29.644323091529223	discard	Failed attempt logged
e7a6d78	29.085144881651637	discard	Failed attempt logged
5990982	24.628878251515673	discard	Failed attempt logged
f3b8c26	22.77724312653744	discard	Failed attempt logged
f3b8c26	22.77724312653744	discard	Failed attempt logged
e72ce38	29.644323091529223	discard	Failed attempt logged
5c5f849	23.905725857740666	discard	Failed attempt logged
de842b0	18.20518017537127	discard	Failed attempt logged
5990982	24.628878251515673	discard	Failed attempt logged
7e41c15	25.670014756628646	discard	Failed attempt logged
0a070f2	27.264501226179405	discard	Failed attempt logged
5990982	24.628878251515673	discard	Failed attempt logged
15b83b1	21.788316260611218	discard	Failed attempt logged
5990982	24.628878251515673	discard	Failed attempt logged
914c189	24.808396698371983	discard	Failed attempt logged
bb03221	22.701979081653366	discard	Failed attempt logged
1dadc48	19.25344672955387	discard	Failed attempt logged
5c5f849	23.905725857740666	discard	Failed attempt logged
6f532f9	42.096473625120744	keep	Highly profitable runner-up
1dadc48	19.25344672955387	discard	Failed attempt logged
1dadc48	19.25344672955387	discard	Failed attempt logged
5c5f849	23.905725857740666	discard	Failed attempt logged
5c5f849	23.905725857740666	discard	Failed attempt logged
914c189	24.808396698371983	discard	Failed attempt logged
e8eeb5b	18.13516777014701	discard	Failed attempt logged
e7a6d78	29.085144881651637	discard	Failed attempt logged
5fde799	16.774708776086445	discard	Failed attempt logged
e72ce38	29.644323091529223	discard	Failed attempt logged
bb2d4db	8.765182075682887	discard	Failed attempt logged
773f517	15.09232221843968	discard	Failed attempt logged
5990982	24.628878251515673	discard	Failed attempt logged
914c189	24.808396698371983	discard	Failed attempt logged
e72ce38	29.644323091529223	discard	Failed attempt logged
5fde799	16.774708776086445	discard	Failed attempt logged
e7a6d78	29.085144881651637	discard	Failed attempt logged
6caa70a	6.5291948451153825	discard	Failed attempt logged
3eda08c	6.011718568401636	discard	Failed attempt logged
6ec4dfd	9.283298006170583	discard	Failed attempt logged
e72ce38	29.644323091529223	discard	Failed attempt logged
5fde799	16.774708776086445	discard	Failed attempt logged
5fde799	16.774708776086445	discard	Failed attempt logged
de842b0	18.20518017537127	discard	Failed attempt logged
0a070f2	27.264501226179405	discard	Failed attempt logged
5990982	24.628878251515673	discard	Failed attempt logged
34543c8	16.317748970866287	discard	Failed attempt logged
3eda08c	6.011718568401636	discard	Failed attempt logged
5c5f849	23.905725857740666	discard	Failed attempt logged
0a070f2	27.264501226179405	discard	Failed attempt logged
a7e1cab	26.744778999100415	discard	Failed attempt logged
5c5f849	23.905725857740666	discard	Failed attempt logged
bb2d4db	8.765182075682887	discard	Failed attempt logged
ec13f8b	21.042612867904744	discard	Failed attempt logged
914c189	24.808396698371983	discard	Failed attempt logged
a7e1cab	26.744778999100415	discard	Failed attempt logged
5fde799	16.774708776086445	discard	Failed attempt logged
de9a68e	33.17305644097024	discard	Failed attempt logged
5c5f849	23.905725857740666	discard	Failed attempt logged
7dad37a	21.753679422018447	discard	Failed attempt logged
6a6d42c	24.618420130071918	discard	Failed attempt logged
05b1cd6	12.173091219488041	discard	Failed attempt logged
5fde799	16.774708776086445	discard	Failed attempt logged
5c5f849	23.905725857740666	discard	Failed attempt logged
f3b8c26	22.77724312653744	discard	Failed attempt logged
5fde799	16.774708776086445	discard	Failed attempt logged
0a070f2	27.264501226179405	discard	Failed attempt logged
15b83b1	21.788316260611218	discard	Failed attempt logged
3043291	-6.924408219340883	discard	Failed attempt logged
f3b8c26	22.77724312653744	discard	Failed attempt logged
a7e1cab	26.744778999100415	discard	Failed attempt logged
6ec4dfd	9.283298006170583	discard	Failed attempt logged
0a070f2	27.264501226179405	discard	Failed attempt logged
0a070f2	27.264501226179405	discard	Failed attempt logged
e5a2910	39.01573373876332	keep	Highly profitable runner-up
6e15901	30.308601944191714	discard	Failed attempt logged
f1eea43	5.841901601199795	discard	Failed attempt logged
9e4f851	13.578508100643937	discard	Failed attempt logged
9e4f851	13.578508100643937	discard	Failed attempt logged
9e4f851	13.578508100643937	discard	Failed attempt logged
9e4f851	13.578508100643937	discard	Failed attempt logged
05b1cd6	12.173091219488041	discard	Failed attempt logged
05b1cd6	12.173091219488041	discard	Failed attempt logged
9e4f851	13.578508100643937	discard	Failed attempt logged
dcabdbb	23.700122897481847	discard	Failed attempt logged
1dadc48	19.25344672955387	discard	Failed attempt logged
05b1cd6	12.173091219488041	discard	Failed attempt logged
9e4f851	13.578508100643937	discard	Failed attempt logged
dcabdbb	23.700122897481847	discard	Failed attempt logged
9e4f851	13.578508100643937	discard	Failed attempt logged
9e4f851	13.578508100643937	discard	Failed attempt logged
9e4f851	13.578508100643937	discard	Failed attempt logged
9e4f851	13.578508100643937	discard	Failed attempt logged
9e4f851	13.578508100643937	discard	Failed attempt logged
9e4f851	13.578508100643937	discard	Failed attempt logged
b1a7239	27.874210278545817	discard	Failed attempt logged
9e4f851	13.578508100643937	discard	Failed attempt logged
773f517	15.09232221843968	discard	Failed attempt logged
9e4f851	13.578508100643937	discard	Failed attempt logged
8695c10	5.668990370753968	discard	Failed attempt logged
9e4f851	13.578508100643937	discard	Failed attempt logged
9e4f851	13.578508100643937	discard	Failed attempt logged
9e4f851	13.578508100643937	discard	Failed attempt logged
05b1cd6	12.173091219488041	discard	Failed attempt logged
9e4f851	13.578508100643937	discard	Failed attempt logged
9e4f851	13.578508100643937	discard	Failed attempt logged
9e4f851	13.578508100643937	discard	Failed attempt logged
9e4f851	13.578508100643937	discard	Failed attempt logged
5c5f849	23.905725857740666	discard	Failed attempt logged
9e4f851	13.578508100643937	discard	Failed attempt logged
05b1cd6	12.173091219488041	discard	Failed attempt logged
5c5f849	23.905725857740666	discard	Failed attempt logged
6f532f9	42.096473625120744	keep	Highly profitable runner-up
914c189	24.808396698371983	discard	Failed attempt logged
8695c10	5.668990370753968	discard	Failed attempt logged
9e4f851	13.578508100643937	discard	Failed attempt logged
9e4f851	13.578508100643937	discard	Failed attempt logged
05b1cd6	12.173091219488041	discard	Failed attempt logged
5c5f849	23.905725857740666	discard	Failed attempt logged
9e4f851	13.578508100643937	discard	Failed attempt logged
9e4f851	13.578508100643937	discard	Failed attempt logged
9e4f851	13.578508100643937	discard	Failed attempt logged
9e4f851	13.578508100643937	discard	Failed attempt logged
05b1cd6	12.173091219488041	discard	Failed attempt logged
05b1cd6	12.173091219488041	discard	Failed attempt logged
773f517	15.09232221843968	discard	Failed attempt logged
05b1cd6	12.173091219488041	discard	Failed attempt logged
b1a7239	27.874210278545817	discard	Failed attempt logged
05b1cd6	12.173091219488041	discard	Failed attempt logged
9e4f851	13.578508100643937	discard	Failed attempt logged
b1a7239	27.874210278545817	discard	Failed attempt logged
5c5f849	23.905725857740666	discard	Failed attempt logged
0a070f2	27.264501226179405	discard	Failed attempt logged
05b1cd6	12.173091219488041	discard	Failed attempt logged
05b1cd6	12.173091219488041	discard	Failed attempt logged
05b1cd6	12.173091219488041	discard	Failed attempt logged
b1a7239	27.874210278545817	discard	Failed attempt logged
5c5f849	23.905725857740666	discard	Failed attempt logged
9e4f851	13.578508100643937	discard	Failed attempt logged
05b1cd6	12.173091219488041	discard	Failed attempt logged
5c5f849	23.905725857740666	discard	Failed attempt logged
05b1cd6	12.173091219488041	discard	Failed attempt logged
9e4f851	13.578508100643937	discard	Failed attempt logged
05b1cd6	12.173091219488041	discard	Failed attempt logged
5c5f849	23.905725857740666	discard	Failed attempt logged
b1a7239	27.874210278545817	discard	Failed attempt logged
9e4f851	13.578508100643937	discard	Failed attempt logged
05b1cd6	12.173091219488041	discard	Failed attempt logged
dcabdbb	23.700122897481847	discard	Failed attempt logged
05b1cd6	12.173091219488041	discard	Failed attempt logged
9e4f851	13.578508100643937	discard	Failed attempt logged
9e4f851	13.578508100643937	discard	Failed attempt logged
05b1cd6	12.173091219488041	discard	Failed attempt logged
9e4f851	13.578508100643937	discard	Failed attempt logged
9e4f851	13.578508100643937	discard	Failed attempt logged
9e4f851	13.578508100643937	discard	Failed attempt logged
05b1cd6	12.173091219488041	discard	Failed attempt logged
9e4f851	13.578508100643937	discard	Failed attempt logged
dcabdbb	23.700122897481847	discard	Failed attempt logged
5c5f849	23.905725857740666	discard	Failed attempt logged
9e4f851	13.578508100643937	discard	Failed attempt logged
9e4f851	13.578508100643937	discard	Failed attempt logged
9e4f851	13.578508100643937	discard	Failed attempt logged
8695c10	5.668990370753968	discard	Failed attempt logged
9e4f851	13.578508100643937	discard	Failed attempt logged
9e4f851	13.578508100643937	discard	Failed attempt logged
9e4f851	13.578508100643937	discard	Failed attempt logged
5c5f849	23.905725857740666	discard	Failed attempt logged
9e4f851	13.578508100643937	discard	Failed attempt logged
9e4f851	13.578508100643937	discard	Failed attempt logged
9e4f851	13.578508100643937	discard	Failed attempt logged
9e4f851	13.578508100643937	discard	Failed attempt logged
dcabdbb	23.700122897481847	discard	Failed attempt logged
f3fe40a	1.162050877541776	discard	Failed attempt logged
bb2d4db	8.765182075682887	discard	Failed attempt logged
9e4f851	13.578508100643937	discard	Failed attempt logged
9e4f851	13.578508100643937	discard	Failed attempt logged
9e4f851	13.578508100643937	discard	Failed attempt logged
dcabdbb	23.700122897481847	discard	Failed attempt logged
05b1cd6	12.173091219488041	discard	Failed attempt logged
05b1cd6	12.173091219488041	discard	Failed attempt logged
05b1cd6	12.173091219488041	discard	Failed attempt logged
9e4f851	13.578508100643937	discard	Failed attempt logged
0a070f2	27.264501226179405	discard	Failed attempt logged
05b1cd6	12.173091219488041	discard	Failed attempt logged
05b1cd6	12.173091219488041	discard	Failed attempt logged
05b1cd6	12.173091219488041	discard	Failed attempt logged
05b1cd6	12.173091219488041	discard	Failed attempt logged
dcabdbb	23.700122897481847	discard	Failed attempt logged
9e4f851	13.578508100643937	discard	Failed attempt logged
9e4f851	13.578508100643937	discard	Failed attempt logged
dcabdbb	23.700122897481847	discard	Failed attempt logged
9e4f851	13.578508100643937	discard	Failed attempt logged
9e4f851	13.578508100643937	discard	Failed attempt logged
9e4f851	13.578508100643937	discard	Failed attempt logged
9e4f851	13.578508100643937	discard	Failed attempt logged
9e4f851	13.578508100643937	discard	Failed attempt logged
b1a7239	27.874210278545817	discard	Failed attempt logged
de9a68e	33.17305644097024	discard	Failed attempt logged
5c5f849	23.905725857740666	discard	Failed attempt logged
05b1cd6	12.173091219488041	discard	Failed attempt logged
b26a1fa	5.50916244677111	discard	Failed attempt logged
05b1cd6	12.173091219488041	discard	Failed attempt logged
dcabdbb	23.700122897481847	discard	Failed attempt logged
05b1cd6	12.173091219488041	discard	Failed attempt logged
9e4f851	13.578508100643937	discard	Failed attempt logged
9e4f851	13.578508100643937	discard	Failed attempt logged
05b1cd6	12.173091219488041	discard	Failed attempt logged
5c5f849	23.905725857740666	discard	Failed attempt logged
5c5f849	23.905725857740666	discard	Failed attempt logged
b1a7239	27.874210278545817	discard	Failed attempt logged
9e4f851	13.578508100643937	discard	Failed attempt logged
05b1cd6	12.173091219488041	discard	Failed attempt logged
9e4f851	13.578508100643937	discard	Failed attempt logged
9e4f851	13.578508100643937	discard	Failed attempt logged
dcabdbb	23.700122897481847	discard	Failed attempt logged
0a070f2	27.264501226179405	discard	Failed attempt logged
9e4f851	13.578508100643937	discard	Failed attempt logged
9e4f851	13.578508100643937	discard	Failed attempt logged
5c5f849	23.905725857740666	discard	Failed attempt logged
9e4f851	13.578508100643937	discard	Failed attempt logged
05b1cd6	12.173091219488041	discard	Failed attempt logged
9e4f851	13.578508100643937	discard	Failed attempt logged
de9a68e	33.17305644097024	discard	Failed attempt logged
9e4f851	13.578508100643937	discard	Failed attempt logged
05b1cd6	12.173091219488041	discard	Failed attempt logged
b1a7239	27.874210278545817	discard	Failed attempt logged
8695c10	5.668990370753968	discard	Failed attempt logged
05b1cd6	12.173091219488041	discard	Failed attempt logged
5c5f849	23.905725857740666	discard	Failed attempt logged
b1a7239	27.874210278545817	discard	Failed attempt logged
dcabdbb	23.700122897481847	discard	Failed attempt logged
f19c8cd	17.581767599946097	discard	Failed attempt logged
9e4f851	13.578508100643937	discard	Failed attempt logged
05b1cd6	12.173091219488041	discard	Failed attempt logged
dcabdbb	23.700122897481847	discard	Failed attempt logged
05b1cd6	12.173091219488041	discard	Failed attempt logged
9e4f851	13.578508100643937	discard	Failed attempt logged
9e4f851	13.578508100643937	discard	Failed attempt logged
9e4f851	13.578508100643937	discard	Failed attempt logged
0a070f2	27.264501226179405	discard	Failed attempt logged
5f85e40	5.818661596643282	discard	Failed attempt logged
05b1cd6	12.173091219488041	discard	Failed attempt logged
0a070f2	27.264501226179405	discard	Failed attempt logged
6caa70a	6.5291948451153825	discard	Failed attempt logged
b1a7239	27.874210278545817	discard	Failed attempt logged
9e4f851	13.578508100643937	discard	Failed attempt logged
5c5f849	23.905725857740666	discard	Failed attempt logged
05b1cd6	12.173091219488041	discard	Failed attempt logged
05b1cd6	12.173091219488041	discard	Failed attempt logged
9e4f851	13.578508100643937	discard	Failed attempt logged
dcabdbb	23.700122897481847	discard	Failed attempt logged
5c5f849	23.905725857740666	discard	Failed attempt logged
9e4f851	13.578508100643937	discard	Failed attempt logged
5c5f849	23.905725857740666	discard	Failed attempt logged
9e4f851	13.578508100643937	discard	Failed attempt logged
b1a7239	27.874210278545817	discard	Failed attempt logged
9e4f851	13.578508100643937	discard	Failed attempt logged
