commit	final_result	status	description
55c10eb	-45.446216741771764	keep	Auto-experiment success
0f1f9a6	-37.310032961610816	keep	Auto-experiment success
cb4e283	-55.360752538080135	discard	Failed attempt logged
0ad4b7c	-46.97419862987872	discard	Failed attempt logged
0a4a060	-41.125514656628255	discard	Failed attempt logged
692833a	-35.1367691968985	discard	Failed attempt logged
98b5785	-44.754713448173796	discard	Failed attempt logged
28d34c8	-47.38166664368317	discard	Failed attempt logged
