commit	final_result	status	description
ebe601d	-999.0	discard	Failed attempt logged
8487ea0	-999.0	discard	Failed attempt logged
0104cd2	-0.37194099291688737	keep	Auto-experiment success
3913fd9	-0.3496837751219645	keep	Auto-experiment success
adcad24	-0.24901221094998377	keep	Auto-experiment success
