4b303fc	-6.625899725447027	keep	Auto-experiment success
36c24a6	-0.9307086767941319	keep	Auto-experiment success
5e4b41f	-0.9214783319188574	keep	Auto-experiment success
a6cae82	-0.4612454299890758	keep	Auto-experiment success
320ba8c	-1.1864286849718992	discard	Failed attempt logged
05722df	-1.5146854585167362	discard	Failed attempt logged
0a19a31	-1.142780183459703	discard	Failed attempt logged
3021198	-1.1379764279278863	discard	Failed attempt logged
499c535	-0.676660560800915	discard	Failed attempt logged
6c4aa29	-1.497402686538853	discard	Failed attempt logged
436b2c7	-0.5501848637422609	discard	Failed attempt logged
b5d54e2	-1.1702519090243877	discard	Failed attempt logged
5056c6a	-0.932758453051884	discard	Failed attempt logged
a6f1c9c	0.03709845934826206	keep	Auto-experiment success
0d541eb	-1.3050398505472511	discard	Failed attempt logged
fca1e83	-0.41861897729098596	discard	Failed attempt logged
c5f8284	-0.9473522496992458	discard	Failed attempt logged
54137f0	-0.5909490662623051	discard	Failed attempt logged
43fe1bf	-0.5866187569027838	discard	Failed attempt logged
9e17dc5	-1.486538386066236	discard	Failed attempt logged
0e7ee55	-1.4367855729293324	discard	Failed attempt logged
1a1e422	0.3202105601161108	keep	Auto-experiment success
c08101e	-0.10968509990442069	discard	Failed attempt logged
3122418	0.05819262798233496	discard	Failed attempt logged
299b9df	-0.8703139925775909	discard	Failed attempt logged
4cbf56e	-0.08759543226195791	discard	Failed attempt logged
8143763	-1.0540669699984815	discard	Failed attempt logged
c5f874e	0.017321898890174103	discard	Failed attempt logged
c7873cc	-0.7295097580497677	discard	Failed attempt logged
ac629c3	-0.360109234372614	discard	Failed attempt logged
29d4f16	0.04653997885691393	discard	Failed attempt logged
2ff61d3	-0.37225705124883	discard	Failed attempt logged
72c500c	0.0	no_change	Aider failed to produce new code
3ddfeb6	-1.733128098764171	discard	Failed attempt logged
b40de04	-0.817687097734197	discard	Failed attempt logged
1cf39a1	-0.9433754936463353	discard	Failed attempt logged
0d37e8e	-0.38745584865941973	discard	Failed attempt logged
05f1528	-0.7841391966807849	discard	Failed attempt logged
fc62527	-0.8276435430175164	discard	Failed attempt logged
5b34548	-0.3348682665348536	discard	Failed attempt logged
3ba8948	-0.4123095494137273	discard	Failed attempt logged
24b4e7c	-0.0922302890888039	discard	Failed attempt logged
34a1b95	-0.840050155417906	discard	Failed attempt logged
050114c	-0.7001411783877652	discard	Failed attempt logged
143e361	-0.36071051788291625	discard	Failed attempt logged
d6572fa	-1.3506803367088223	discard	Failed attempt logged
c355a8f	-0.9792957693709176	discard	Failed attempt logged
6aacced	-0.5358946968782793	discard	Failed attempt logged
e5aba83	-0.24013253395465317	discard	Failed attempt logged
b6e24ea	0.2697799112468139	discard	Failed attempt logged
82bf582	-1.4292232350189882	discard	Failed attempt logged
6b64e44	-1.4292720621597468	discard	Failed attempt logged
bfa1b16	-0.2735708793338485	discard	Failed attempt logged
7f1f78d	-1.354786201849929	discard	Failed attempt logged
0ca21fb	-0.6570812394448987	discard	Failed attempt logged
012f729	-0.9342458883575789	discard	Failed attempt logged
57d8114	-0.12863373166379977	discard	Failed attempt logged
3ada499	-0.22451430459980637	discard	Failed attempt logged
4104a5c	-1.446738758839058	discard	Failed attempt logged
9264b64	0.005218381454955998	discard	Failed attempt logged
33b1bd0	-1.4955794002713594	discard	Failed attempt logged
cc8ac20	-0.8719623568635045	discard	Failed attempt logged
e1be918	-0.3420424656768714	discard	Failed attempt logged
b0fcb6f	-0.8443279190332267	discard	Failed attempt logged
c7acd13	-0.3294925436493279	discard	Failed attempt logged
ca2e47b	-0.4853010000099425	discard	Failed attempt logged
f052313	0.0	crash	Failed attempt logged
8788db1	-0.5743413775650235	discard	Failed attempt logged
d5dfd40	-0.028367058952840793	discard	Failed attempt logged
19f19a9	-0.21100961520525602	discard	Failed attempt logged
3d0faff	-0.7803289679247074	discard	Failed attempt logged
1206df6	-0.6879425187357168	discard	Failed attempt logged
191bf45	-0.6770298097738301	discard	Failed attempt logged
676c156	-0.3657857893569441	discard	Failed attempt logged
858e424	0.3391132276029318	keep	Auto-experiment success
40aa05e	0.019770768318959187	discard	Failed attempt logged
00e8da4	0.11536518377592589	discard	Failed attempt logged
8c3d0bf	-1.0637942563239189	discard	Failed attempt logged
e1c7b51	-0.4011386534834248	discard	Failed attempt logged
820524d	0.045091967409724446	discard	Failed attempt logged
d27c5dd	0.0	crash	Failed attempt logged
8dfa88e	-0.3462232094822184	discard	Failed attempt logged
918366a	0.04119072247720105	discard	Failed attempt logged
7ba1485	0.2523135639068146	discard	Failed attempt logged
3029174	-0.6864477628152378	discard	Failed attempt logged
10597ef	-0.30900984919164626	discard	Failed attempt logged
aca60e6	-0.9283241748480237	discard	Failed attempt logged
c4d76e6	-0.7017176017537914	discard	Failed attempt logged
a94ba47	-0.007091705036742197	discard	Failed attempt logged
c764bd6	-0.8985899603047423	discard	Failed attempt logged
1e2416c	0.19647869983877325	discard	Failed attempt logged
7266c07	-0.32997446814506853	discard	Failed attempt logged
b21bc4f	-0.050865981554552325	discard	Failed attempt logged
9b5d772	0.07277869137445425	discard	Failed attempt logged
80195c0	-0.905619075193448	discard	Failed attempt logged
fb5980d	0.2523135639068146	discard	Failed attempt logged
160b1a2	-0.5752251207870231	discard	Failed attempt logged
045c401	0.3103983505851736	discard	Failed attempt logged
2d0f281	0.19919116420764815	discard	Failed attempt logged
85dc925	-0.9773963720393176	discard	Failed attempt logged
ee6baa3	-0.25859772441413986	discard	Failed attempt logged
27683df	-0.7003341466604104	discard	Failed attempt logged
9785a16	-1.1213593355864495	discard	Failed attempt logged
5b78cc2	-0.1719158759669049	discard	Failed attempt logged
09089fc	-0.3455481539590585	discard	Failed attempt logged
d9c1cba	0.040458596186549914	discard	Failed attempt logged
ec5c236	-0.2733255994117272	discard	Failed attempt logged
2d15810	-0.6262966212024991	discard	Failed attempt logged
31c7589	-0.40986090359286353	discard	Failed attempt logged
3a1651f	-0.6931695464488481	discard	Failed attempt logged
4088dab	-0.9305523357746401	discard	Failed attempt logged
a3d5b15	-0.35246845683112515	discard	Failed attempt logged
07a27c0	-0.43430157023910976	discard	Failed attempt logged
7e9d0ae	-0.5979451477814276	discard	Failed attempt logged
1b0d171	-2.14134211731813	discard	Failed attempt logged
4b73d99	-1.818228036148039	discard	Failed attempt logged
e640bcb	-0.18897192538670993	discard	Failed attempt logged
4c6da3f	-0.5628266455504669	discard	Failed attempt logged
3d0fdbc	-0.16948223256646924	discard	Failed attempt logged
f7194d5	0.040458596186549914	discard	Failed attempt logged
30076e1	-0.14959411959375843	discard	Failed attempt logged
4502c5e	-0.5592219742977014	discard	Failed attempt logged
4aaa8c7	0.11978157496344778	discard	Failed attempt logged
dd2a14e	-0.9786591662780705	discard	Failed attempt logged
3ae45c9	-0.9744344940062851	discard	Failed attempt logged
7b91cb3	-0.17181730647565002	discard	Failed attempt logged
2bf375d	0.2545748452408242	discard	Failed attempt logged
697f099	-0.23227786427403016	discard	Failed attempt logged
7ded6ed	0.2987588255220207	discard	Failed attempt logged
2ee9c48	-0.546243314967425	discard	Failed attempt logged
db24427	-1.0115681583633618	discard	Failed attempt logged
acf94b7	-0.9512243610122701	discard	Failed attempt logged
b786709	0.21708510495109534	discard	Failed attempt logged
81ba942	0.18703112853403225	discard	Failed attempt logged
4832cad	0.2490843900642868	discard	Failed attempt logged
dea4b26	0.2545748452408242	discard	Failed attempt logged
975b5fa	-0.913179892800524	discard	Failed attempt logged
b969360	0.09318235589533075	discard	Failed attempt logged
83a0c39	-0.028236629464639812	discard	Failed attempt logged
3c22566	-0.9283241748480237	discard	Failed attempt logged
fe7faac	-0.9437504988908951	discard	Failed attempt logged
20aefe9	-0.3713212345908429	discard	Failed attempt logged
5d328d9	-0.2533152702839836	discard	Failed attempt logged
2058b6e	-0.40071230200244023	discard	Failed attempt logged
70cdcc4	-0.43599210131322863	discard	Failed attempt logged
c14859b	-0.5216336767961318	discard	Failed attempt logged
8f3d56a	-0.5954499830385974	discard	Failed attempt logged
7ccca5d	-1.245709761341205	discard	Failed attempt logged
5c2fe11	-0.47447315622098507	discard	Failed attempt logged
2facf6a	-0.5307702472176578	discard	Failed attempt logged
1c8bc52	0.013806891946750138	discard	Failed attempt logged
121bdfd	-0.43430157023910976	discard	Failed attempt logged
cd8b051	-0.44779998144516064	discard	Failed attempt logged
ff921d2	0.24179644902852543	discard	Failed attempt logged
95eb943	-0.779068385542226	discard	Failed attempt logged
f950d92	-0.4038243330330719	discard	Failed attempt logged
382565c	-0.5807514417327994	discard	Failed attempt logged
2d9a5af	-0.07581386034580058	discard	Failed attempt logged
9815df1	-0.3319552597659855	discard	Failed attempt logged
2fb62a6	-0.45802972051190427	discard	Failed attempt logged
34183d6	-1.0270578198201483	discard	Failed attempt logged
a215173	-0.35584677295052825	discard	Failed attempt logged
8530e02	-0.36667652759801633	discard	Failed attempt logged
1c0f0e2	0.04119072247720105	discard	Failed attempt logged
b3c8b44	-0.47447315622098507	discard	Failed attempt logged
22d7817	0.20273343965972568	discard	Failed attempt logged
0d18b56	-0.9283241748480237	discard	Failed attempt logged
9a89beb	0.19647869983877325	discard	Failed attempt logged
04cf339	-0.5086536449628716	discard	Failed attempt logged
cfd96ea	0.19647869983877325	discard	Failed attempt logged
b849377	-1.0249867156826722	discard	Failed attempt logged
8ce53e1	-0.32621321096784334	discard	Failed attempt logged
31d989e	-0.03058836040896761	discard	Failed attempt logged
807eca1	0.053454637887800145	discard	Failed attempt logged
080a87a	0.11238951282100658	discard	Failed attempt logged
0943e55	-0.3455481539590585	discard	Failed attempt logged
68ec482	-0.23347855260886713	discard	Failed attempt logged
e48d962	-0.29870844614718783	discard	Failed attempt logged
96ae4b1	-1.3877156463435314	discard	Failed attempt logged
ed939bb	0.07524594472639329	discard	Failed attempt logged
1e754fb	-0.8422557404715064	discard	Failed attempt logged
8e76d50	-0.8820385571831197	discard	Failed attempt logged
3b7f559	-0.48341561307304914	discard	Failed attempt logged
4bebd05	-0.8595641598949634	discard	Failed attempt logged
cdebf4d	-0.5979451477814276	discard	Failed attempt logged
660062a	-0.5979451477814276	discard	Failed attempt logged
346df33	-0.26759750436495006	discard	Failed attempt logged
6e98893	0.19647869983877325	discard	Failed attempt logged
c8c6e12	0.19647869983877325	discard	Failed attempt logged
b5e404f	0.0	no_change	Aider failed to produce new code
b5e404f	0.0	no_change	Aider failed to produce new code
b5e404f	0.0	no_change	Aider failed to produce new code
b5e404f	0.0	no_change	Aider failed to produce new code
b5e404f	0.0	no_change	Aider failed to produce new code
b5e404f	0.0	no_change	Aider failed to produce new code
b5e404f	0.0	no_change	Aider failed to produce new code
b5e404f	0.0	no_change	Aider failed to produce new code
b5e404f	0.0	no_change	Aider failed to produce new code
e60cb68	-0.8820385571831197	discard	Failed attempt logged
08782f5	-1.916163971365544	discard	Failed attempt logged
8488731	-0.2657543571132543	discard	Failed attempt logged
184649d	-0.2301865365975947	discard	Failed attempt logged
e041b6e	-1.245199630274466	discard	Failed attempt logged
7f40e5b	-0.09341833973776124	discard	Failed attempt logged
b01a8cb	-1.1032831787538964	discard	Failed attempt logged
30102fb	0.19647869983877325	discard	Failed attempt logged
fb6d389	0.21462928955583033	discard	Failed attempt logged
c4a6954	0.18281742212806376	discard	Failed attempt logged
10f4217	0.22629393690709196	discard	Failed attempt logged
d0a7275	-1.0115681583633618	discard	Failed attempt logged
d57f744	-0.9141532841269129	discard	Failed attempt logged
66e0d0a	-0.5676724238865574	discard	Failed attempt logged
c905caf	-0.2979160023390536	discard	Failed attempt logged
1ccc048	-0.1254895727863037	discard	Failed attempt logged
4c6a8d3	-0.5752251207870231	discard	Failed attempt logged
1de83df	-0.3391727131011916	discard	Failed attempt logged
d0f96cc	-0.5449855323688304	discard	Failed attempt logged
3758510	0.2281870045971602	discard	Failed attempt logged
68071f6	0.19647869983877325	discard	Failed attempt logged
4a63f00	-0.6896817773050726	discard	Failed attempt logged
d50909b	-0.8891687842225249	discard	Failed attempt logged
