commit	final_result	status	description
b73e82d	-41.79722838147928	keep	Auto-experiment success
c97e310	-39.77874588491607	discard	Failed attempt logged
6438458	-34.77751527455965	keep	Auto-experiment success
783b15b	-61.88736087821498	discard	Failed attempt logged
6c2fc76	-32.46510436370163	keep	Auto-experiment success
